{
  "schema_version": "1.1",
  "document_id": "degraded-scan",
  "reference_text": "SYNTHETIC DEGRADED SCAN - PUBLIC TEST DATA Batch ID: SCAN-042 Status: archived for evaluation only",
  "reference_basis": "synthetic_exact",
  "reference_pages": {},
  "anchors": [],
  "tables": [],
  "grounding_regions": {},
  "schema_output": null,
  "continuity_pairs": [],
  "forbidden_literals": [],
  "rejected_block_ids": []
}
