{
  "schema_version": "1.1",
  "document_id": "figure-chart",
  "reference_text": "Synthetic Bar Chart Units by period P1: 4 P2: 7 P3: 5",
  "reference_basis": "synthetic_exact",
  "reference_pages": {},
  "anchors": [],
  "tables": [],
  "grounding_regions": {
    "chart-1": [
      0.08,
      0.12,
      0.72,
      0.42
    ]
  },
  "schema_output": null,
  "continuity_pairs": [],
  "forbidden_literals": [],
  "rejected_block_ids": []
}
